user,assistant,mean,stdDev,threshold,iterations
"Buenos dias, como estas?","¡Hola! Buenos días. Soy el asistente virtual de la tienda en línea y estoy aquí para ayudarte con información sobre disponibilidad de productos, opciones de pago y ubicaciones de recogida en tienda. ¿En qué puedo ayudarte hoy?",0.9839170547781255,0.004138037038311033,0.976250791596312,3
Tienen el Samsung s24?,"¡Sí! Tenemos disponible el Samsung Galaxy S24. Actualmente contamos con 30 unidades en stock. El precio es de $899.99 y viene con una pantalla Dynamic AMOLED 2X de 6.2 pulgadas, 8GB de RAM y 128GB de almacenamiento. ¿Te gustaría conocer más detalles sobre el dispositivo o información sobre las opciones de pago?",0.9857050704142143,0.009830292495169028,0.9619837513518913,3
Como es el tema de la garantia?,El Samsung Galaxy S24 viene con una garantía estándar de 1 año contra defectos de fabricación. También ofrecemos una garantía extendida opcional que puede ampliar la cobertura hasta 3 años por un costo adicional.   Los reclamos de garantía se pueden realizar de dos formas: 1. En cualquiera de nuestras tiendas físicas 2. En línea a través de nuestro servicio de atención al cliente  ¿Te gustaría conocer los precios de la garantía extendida o tienes alguna otra pregunta sobre las opciones de pago o disponibilidad?,0.8954962855019306,0.04365815990052701,0.7929636650585422,3
Hacen envios?,"¡Sí! Tenemos varias opciones de envío disponibles:  1. Envío Estándar: - 3-5 días hábiles a todo el país - Costo: $150 UYU - ¡Gratis en compras superiores a $2,000 UYU!  2. Envío Exprés: - 1-2 días hábiles - Costo: $500 UYU  3. Entrega el Mismo Día: - Solo para Montevideo - Pedidos realizados antes de las 12:00 PM - Costo: $700 UYU  También puedes optar por recoger tu pedido en cualquiera de nuestras sucursales. ¿Te gustaría conocer las ubicaciones de nuestros puntos de recogida?",0.8162825490195146,0.004257737013463645,0.8066114040669126,3
Tienen el iphone 15?,"¡Sí! Tenemos disponible el iPhone 15 Pro. Actualmente contamos con 50 unidades en stock. El precio es de $999.99 y viene con una pantalla OLED Super Retina de 6.1 pulgadas, chip A17 Bionic, 6GB de RAM y 128GB de almacenamiento. También cuenta con un sistema de cámara triple de 48MP y una batería de 3200mAh.  ¿Te gustaría saber más sobre las opciones de pago o las ubicaciones de recogida en tienda?",0.9775619352683712,0.010551111884960267,0.9556282066304237,3
